{
  "contract_version": "2",
  "req_id": "00000001",
  "outcome": "accepted",
  "detail": null,
  "reason_code": "allowlisted",
  "ts": "2026-07-20T04:06:00Z",
  "recipients": ["owner@example.com"],
  "message_id": "<00000001@relay.example.com>",
  "job_id": "0bfdc9ba",
  "attestation": {
    "form": "self-stamp",
    "token": "selfstamp.v1.stub",
    "claims": {
      "agent": "agent-research",
      "acts_for": "owner@example.com",
      "issued_at": "2026-07-20T04:06:00Z"
    }
  }
}
